{
  "schemaVersion": 3,
  "toolchain": { "goVersion": "go1.26.6" },
  "defaults": {
    "includeFamilies": ["feature", "fix", "docs", "refactor", "chore", "test", "perf", "hotfix"]
  },
  "gates": [
    {
      "name": "full-local-build",
      "command": "go",
      "args": ["tool", "-modfile", "tools/go.mod", "quality-gate"],
      "timeout": "15m",
      "workingDirectory": ".",
      "includeFamilies": ["feature"]
    }
  ],
  "project": {
    "binaries": [{ "package": "./cmd/tool", "smoke": ["--version"] }],
    "fuzz": [{ "package": "./internal/boundary", "target": "FuzzParse", "time": "50000x" }]
  }
}
